{
  "authority_ref": "house_tang",
  "commander_ref": "char_lin_jiao",
  "communication_ref": null,
  "context": "nested_army",
  "created_at": "244-BCE-09-09T20:22:48+08:00",
  "direct_person_refs": [
    "char_he_shan",
    "char_mu_zhen"
  ],
  "display_name": "Outer Wall",
  "id": "cmdgrp.house_tang.outer_wall",
  "location": "loc_tang_manor",
  "organizational_state": {
    "authorized_direct_unit_slots": 26,
    "authorized_strength": 109974,
    "current_direct_formation_strength": 109974,
    "current_recursive_strength": 109974,
    "direct_unit_count": 26,
    "mission": "outer_wall_defense",
    "recursive_formation_count": 26,
    "reorganization_need": "none",
    "status": "active"
  },
  "parent_command_group_ref": "cmdgrp.house_tang.field_army",
  "role_assignments": {
    "char_he_shan": "training_and_operations_officer",
    "char_mu_zhen": "operations_officer"
  },
  "schema": "command-group",
  "standing_doctrine_ref": "doc.house_tang.home_defense",
  "standing_order_refs": [],
  "successor_refs": [],
  "units": [
    {
      "kind": "formation",
      "ref": "formation_house_tang_outer_wall_iron_wall_01"
    },
    {
      "kind": "formation",
      "ref": "formation_house_tang_outer_wall_iron_wall_02"
    },
    {
      "kind": "formation",
      "ref": "formation_house_tang_outer_wall_iron_wall_03"
    },
    {
      "kind": "formation",
      "ref": "formation_house_tang_outer_wall_iron_wall_04"
    },
    {
      "kind": "formation",
      "ref": "formation_house_tang_outer_wall_iron_wall_05"
    },
    {
      "kind": "formation",
      "ref": "formation_house_tang_outer_wall_iron_wall_06"
    },
    {
      "kind": "formation",
      "ref": "formation_house_tang_outer_wall_iron_wall_07"
    },
    {
      "kind": "formation",
      "ref": "formation_house_tang_outer_wall_iron_wall_08"
    },
    {
      "kind": "formation",
      "ref": "formation_house_tang_outer_wall_iron_wall_09"
    },
    {
      "kind": "formation",
      "ref": "formation_house_tang_outer_wall_iron_wall_10"
    },
    {
      "kind": "formation",
      "ref": "formation_house_tang_outer_wall_iron_wall_11"
    },
    {
      "kind": "formation",
      "ref": "formation_house_tang_outer_wall_iron_wall_12"
    },
    {
      "kind": "formation",
      "ref": "formation_house_tang_outer_wall_iron_wall_13"
    },
    {
      "kind": "formation",
      "ref": "formation_house_tang_outer_wall_iron_wall_14"
    },
    {
      "kind": "formation",
      "ref": "formation_house_tang_outer_wall_iron_wall_15"
    },
    {
      "kind": "formation",
      "ref": "formation_house_tang_outer_wall_red_thunder_01"
    },
    {
      "kind": "formation",
      "ref": "formation_house_tang_outer_wall_red_thunder_02"
    },
    {
      "kind": "formation",
      "ref": "formation_house_tang_outer_wall_red_thunder_03"
    },
    {
      "kind": "formation",
      "ref": "formation_house_tang_outer_wall_red_thunder_04"
    },
    {
      "kind": "formation",
      "ref": "formation_house_tang_outer_wall_stone_spear_01"
    },
    {
      "kind": "formation",
      "ref": "formation_house_tang_outer_wall_stone_spear_02"
    },
    {
      "kind": "formation",
      "ref": "formation_house_tang_outer_wall_stone_spear_03"
    },
    {
      "kind": "formation",
      "ref": "formation_house_tang_outer_wall_white_blade_01"
    },
    {
      "kind": "formation",
      "ref": "formation_house_tang_outer_wall_white_blade_02"
    },
    {
      "kind": "formation",
      "ref": "formation_house_tang_outer_wall_white_blade_03"
    },
    {
      "kind": "formation",
      "ref": "formation_house_tang_outer_wall_white_blade_04"
    }
  ],
  "updated_at": "244-BCE-09-09T20:22:48+08:00"
}
