{"authority_ref":"char_tang_wei","commander_ref":"char_tang_command_high_guard_unit_1","communication_ref":null,"context":"nested_army","created_at":"244-BCE-09-09T20:22:48+08:00","direct_person_refs":[],"display_name":"High Guard Infantry Thousand 1","id":"cmdgrp.tang_wei.high_guard.unit_1","location":"loc_sanyou","organizational_state":{"authorized_direct_unit_slots":2,"authorized_strength":1000,"current_direct_formation_strength":0,"current_recursive_strength":1000,"direct_unit_count":2,"mission":"hq_infantry_thousand","recursive_formation_count":0,"reorganization_need":"none","status":"active"},"parent_command_group_ref":"cmdgrp.tang_wei.high_guard.foot_wing","role_assignments":{},"schema":"command-group","standing_doctrine_ref":"doc.tang_wei.high_guard","standing_order_refs":[],"successor_refs":[],"units":[{"kind":"formation","ref":"formation_high_guard_infantry_01a"},{"kind":"formation","ref":"formation_high_guard_infantry_01b"}],"updated_at":"244-BCE-10-17T04:00:00+08:00"}
