{
  "schema": "command-group",
  "id": "cmdgrp.ou_hon.gyoku_hou",
  "display_name": "Gyoku Hou",
  "context": "independent_field_command",
  "authority_ref": "state_qin",
  "commander_ref": "char_ou_hon",
  "direct_person_refs": [],
  "role_assignments": {},
  "successor_refs": [
    "char_kan_jou"
  ],
  "units": [
    {
      "kind": "nested_army",
      "ref": "cmdgrp.ou_hon.gyoku_hou.house_1000"
    },
    {
      "kind": "formation",
      "ref": "formation_qin_gyoku_hou_core"
    }
  ],
  "standing_order_refs": [],
  "standing_doctrine_ref": "doc.gyoku_hou.command",
  "communication_ref": null,
  "location": "loc_qin_regional_01",
  "parent_command_group_ref": null,
  "created_at": "244-BCE-09-09T20:22:48+08:00",
  "updated_at": "244-BCE-09-09T20:22:48+08:00",
  "active_context_ref": "operation_arc_131572c4e8a2892bbc",
  "organizational_state": {
    "authorized_direct_unit_slots": 2,
    "authorized_strength": 1500,
    "current_direct_formation_strength": 500,
    "current_recursive_strength": 1500,
    "direct_unit_count": 2,
    "mission": "young_independent_command",
    "recursive_formation_count": 1,
    "reorganization_need": "none",
    "status": "active"
  }
}
